{
  "schema": "mr.manifest/1",
  "version": "2026-09-27T040220Z",
  "base_path": "v=2026-09-27T040220Z/",
  "generated_at": "2026-09-27T04:02:20Z",
  "data_as_of": "2026-09-19",
  "formats": [
    "standard"
  ],
  "sides": [
    "corp",
    "runner"
  ],
  "restrictions": [
    {
      "id": "all",
      "name": "All ban lists",
      "date_start": null
    },
    {
      "id": "standard_ban_list_26_05",
      "name": "Standard Ban List 26.05",
      "date_start": "2026-05-01"
    },
    {
      "id": "standard_balance_update_26_08",
      "name": "Standard Balance Update 26.08",
      "date_start": "2026-08-01"
    }
  ],
  "tier_groups": [
    {
      "id": "all",
      "name": "All tiers"
    },
    {
      "id": "gnk",
      "name": "GNK/CTK"
    },
    {
      "id": "store",
      "name": "Store/District"
    },
    {
      "id": "megacity",
      "name": "Megacity+"
    },
    {
      "id": "online",
      "name": "Online/Community/Other"
    }
  ],
  "months": [
    "2026-06",
    "2026-07",
    "2026-08",
    "2026-09"
  ],
  "period_months": 3,
  "thresholds": {
    "min_games": 30,
    "min_entries": 20,
    "min_splash_decks": 20,
    "coverage_hc": 0.7,
    "min_players": 8
  },
  "paths": {
    "catalog": "catalog/cards.json",
    "summary": "meta/{side}/{restriction}/{tier_group}/summary.json",
    "trends": "meta/{side}/{restriction}/{tier_group}/trends.json",
    "summary_cut": "meta/{side}/{restriction}/{tier_group}/cut/summary.json",
    "trends_cut": "meta/{side}/{restriction}/{tier_group}/cut/trends.json",
    "tournaments": "meta/{restriction}/{tier_group}/tournaments.json",
    "identities": "meta/{side}/{restriction}/{tier_group}/identities.json",
    "quality": "quality/report.json",
    "breaker_bay": "breaker-bay/pool.json"
  },
  "schemas": {
    "manifest": "mr.manifest/1",
    "summary": "mr.summary/1",
    "trends": "mr.trends/1",
    "identities": "mr.identities/1",
    "catalog": "mr.catalog/1",
    "quality": "mr.quality/1",
    "breaker_bay": "mr.breaker_bay/1"
  },
  "attribution": {
    "text": "Tournament results from AlwaysBeRunning.net and NSG Cobra; decklists from NetrunnerDB and NSG Cobra; card data from NetrunnerDB.",
    "links": [
      {
        "name": "AlwaysBeRunning.net",
        "url": "https://alwaysberunning.net"
      },
      {
        "name": "NSG Cobra",
        "url": "https://tournaments.nullsignal.games"
      },
      {
        "name": "NetrunnerDB",
        "url": "https://netrunnerdb.com"
      }
    ]
  },
  "disclaimer": "Fan project, not affiliated with Null Signal Games."
}
